{
  "layer": "l3",
  "node_id": "obolos-mainnet-validator-1",
  "network": "mainnet",
  "p2p_port": 10333,
  "rpc_port": 10332,
  "data_dir": "/var/lib/pantheon/l3",
  "genesis_file": "genesis_obolos.json",
  "commitment_interval": 5,
  "checkpoint_freshness_slo_seconds": 300,
  "relayer_liveness_threshold_seconds": 120
}
